{
  "lec_version": "0.1.0",
  "created_at_utc": "2026-02-18T07:28:24.832937+00:00",
  "updated_at_utc": "2026-02-18T07:28:24.832955+00:00",
  "question": {
    "title": "Meta-analysis for topic: colchicine_mi",
    "pico": {
      "population": "To be specified",
      "intervention": "To be specified",
      "comparator": "To be specified",
      "outcome": "To be specified"
    }
  },
  "evidence_universe": {
    "discovery_artifacts": [
      {
        "path": "outputs\\run_20260218_072824_247bb60f\\discovery\\discovery_colchicine_mi_2026-02-18.json",
        "sha256": "2accb495ad76d16b63cb3e2478fc00e1e9d912f1c59106c64d96401cbdb13973",
        "candidate_count": 5
      }
    ],
    "statistics": {
      "total_candidates": 5,
      "included": 0,
      "flagged": 2,
      "excluded": 3
    }
  },
  "included_studies": {
    "count": 2,
    "study_ids": [
      "NCT:02551094",
      "NCT:03048825"
    ]
  },
  "analysis": {
    "outcome_type": "binary",
    "effect_measure": "HR",
    "model": {
      "type": "random_effects",
      "method": "REML"
    },
    "results": {
      "pooled": {
        "estimate": 0.7215,
        "ci_low": 0.6243,
        "ci_high": 0.8338,
        "se": 0.0738
      },
      "heterogeneity": {
        "i2": 0,
        "tau2": 0,
        "q": 0.5331,
        "df": 1
      }
    },
    "metaengine_contract": {
      "contract_version": "0.1.0",
      "input": {
        "path": "outputs\\run_20260218_072824_247bb60f\\metaengine\\metaengine_input_colchicine_mi.json",
        "sha256": "17e245431be843b9d50b11d63bc151839ca4e6e51b1d5029ac45d4bcd42791a1"
      },
      "output": {
        "path": "outputs\\run_20260218_072824_247bb60f\\metaengine\\metaengine_output_colchicine_mi.json",
        "sha256": "656812bdd6ab5b35cdd0882a06450d3812477899a0eab29e34a0adbc46dbbd4a"
      }
    }
  },
  "verification": {
    "truthcert": {
      "assurance_level": "bronze",
      "decision": "PASS",
      "certificate": {
        "path": "outputs\\run_20260218_072824_247bb60f\\verification\\certificates\\truthcert_run_20260218_072824_aaddf072.json",
        "sha256": "431c6ccea19d6c9a4167d70bbe0abd67244e086391222285d315315241e75b01"
      },
      "audit_log": {
        "path": "outputs\\run_20260218_072824_247bb60f\\verification\\audit_logs\\audit_run_20260218_072824_aaddf072.json",
        "sha256": "68486a1788c0f8529f50731c66735e7991462c495f047914bf1e97e6f13790f1"
      }
    }
  },
  "reproducibility": {
    "run_id": "run_20260218_072824_b4aaf07a",
    "manifest": {
      "path": "outputs\\run_20260218_072824_247bb60f\\lec_objects\\manifest_run_20260218_072824_b4aaf07a.json",
      "sha256": ""
    },
    "artifacts": [
      {
        "type": "discovery",
        "path": "outputs\\run_20260218_072824_247bb60f\\discovery\\discovery_colchicine_mi_2026-02-18.json",
        "sha256": "2accb495ad76d16b63cb3e2478fc00e1e9d912f1c59106c64d96401cbdb13973",
        "added_at": "2026-02-18T07:28:24.770364+00:00"
      },
      {
        "type": "extraction",
        "path": "data\\sample_extraction.json",
        "sha256": "9c57c4cac7bcbe31c54da6c4969a062477469cc3c542500c890a22ff9dae1ae6",
        "added_at": "2026-02-18T07:28:24.770816+00:00"
      },
      {
        "type": "metaengine_input",
        "path": "outputs\\run_20260218_072824_247bb60f\\metaengine\\metaengine_input_colchicine_mi.json",
        "sha256": "17e245431be843b9d50b11d63bc151839ca4e6e51b1d5029ac45d4bcd42791a1",
        "added_at": "2026-02-18T07:28:24.771119+00:00"
      },
      {
        "type": "metaengine_output",
        "path": "outputs\\run_20260218_072824_247bb60f\\metaengine\\metaengine_output_colchicine_mi.json",
        "sha256": "656812bdd6ab5b35cdd0882a06450d3812477899a0eab29e34a0adbc46dbbd4a",
        "added_at": "2026-02-18T07:28:24.772913+00:00"
      },
      {
        "type": "truthcert",
        "path": "outputs\\run_20260218_072824_247bb60f\\verification\\certificates\\truthcert_run_20260218_072824_aaddf072.json",
        "sha256": "431c6ccea19d6c9a4167d70bbe0abd67244e086391222285d315315241e75b01",
        "added_at": "2026-02-18T07:28:24.792110+00:00"
      },
      {
        "type": "audit_log",
        "path": "outputs\\run_20260218_072824_247bb60f\\verification\\audit_logs\\audit_run_20260218_072824_aaddf072.json",
        "sha256": "68486a1788c0f8529f50731c66735e7991462c495f047914bf1e97e6f13790f1",
        "added_at": "2026-02-18T07:28:24.831391+00:00"
      }
    ]
  }
}