{
  "lec_version": "0.1.0",
  "created_at_utc": "2026-02-18T08:36:51.703602+00:00",
  "updated_at_utc": "2026-02-18T08:36:51.703615+00:00",
  "question": {
    "title": "Meta-analysis for topic: colchicine_mi",
    "pico": {
      "population": "To be specified",
      "intervention": "To be specified",
      "comparator": "To be specified",
      "outcome": "To be specified"
    }
  },
  "evidence_universe": {
    "discovery_artifacts": [
      {
        "path": "outputs\\run_20260218_083651_00a1b445\\discovery\\discovery_colchicine_mi_2026-02-18.json",
        "sha256": "2d3cf6e8a3222e52769eda9aa3f3c1d826a618a3739f3d73e6bd381de3c59caf",
        "candidate_count": 5
      }
    ],
    "statistics": {
      "total_candidates": 5,
      "included": 0,
      "flagged": 2,
      "excluded": 3
    }
  },
  "included_studies": {
    "count": 2,
    "study_ids": [
      "NCT:02551094",
      "NCT:03048825"
    ]
  },
  "analysis": {
    "outcome_type": "binary",
    "effect_measure": "HR",
    "model": {
      "type": "random_effects",
      "method": "REML"
    },
    "results": {
      "pooled": {
        "estimate": 0.7215,
        "ci_low": 0.6243,
        "ci_high": 0.8338,
        "se": 0.0738
      },
      "heterogeneity": {
        "i2": 0,
        "tau2": 0,
        "q": 0.5331,
        "df": 1
      }
    },
    "metaengine_contract": {
      "contract_version": "0.1.0",
      "input": {
        "path": "outputs\\run_20260218_083651_00a1b445\\metaengine\\metaengine_input_colchicine_mi.json",
        "sha256": "a783e6b34752d94db5226b07bdf9cfc86876aaa2e5a15c15ba46f9f7eb7430f3"
      },
      "output": {
        "path": "outputs\\run_20260218_083651_00a1b445\\metaengine\\metaengine_output_colchicine_mi.json",
        "sha256": "656812bdd6ab5b35cdd0882a06450d3812477899a0eab29e34a0adbc46dbbd4a"
      }
    }
  },
  "verification": {
    "truthcert": {
      "assurance_level": "bronze",
      "decision": "PASS",
      "certificate": {
        "path": "outputs\\run_20260218_083651_00a1b445\\verification\\certificates\\truthcert_run_20260218_083651_c953b3c7.json",
        "sha256": "0ccd8fb821db543a5f1cedf1a7c3ce0e2fd34c6d797d8b6ff108abf7f71fafca"
      },
      "audit_log": {
        "path": "outputs\\run_20260218_083651_00a1b445\\verification\\audit_logs\\audit_run_20260218_083651_c953b3c7.json",
        "sha256": "6b6b62d8158ff1a886268d356648292c3311aae24aaa74f52e93be9f28482865"
      }
    }
  },
  "reproducibility": {
    "run_id": "run_20260218_083651_a6dabd6f",
    "manifest": {
      "path": "outputs\\run_20260218_083651_00a1b445\\lec_objects\\manifest_run_20260218_083651_a6dabd6f.json",
      "sha256": ""
    },
    "artifacts": [
      {
        "type": "discovery",
        "path": "outputs\\run_20260218_083651_00a1b445\\discovery\\discovery_colchicine_mi_2026-02-18.json",
        "sha256": "2d3cf6e8a3222e52769eda9aa3f3c1d826a618a3739f3d73e6bd381de3c59caf",
        "added_at": "2026-02-18T08:36:51.653282+00:00"
      },
      {
        "type": "extraction",
        "path": "data\\sample_extraction.json",
        "sha256": "9c57c4cac7bcbe31c54da6c4969a062477469cc3c542500c890a22ff9dae1ae6",
        "added_at": "2026-02-18T08:36:51.653566+00:00"
      },
      {
        "type": "metaengine_input",
        "path": "outputs\\run_20260218_083651_00a1b445\\metaengine\\metaengine_input_colchicine_mi.json",
        "sha256": "a783e6b34752d94db5226b07bdf9cfc86876aaa2e5a15c15ba46f9f7eb7430f3",
        "added_at": "2026-02-18T08:36:51.653765+00:00"
      },
      {
        "type": "metaengine_output",
        "path": "outputs\\run_20260218_083651_00a1b445\\metaengine\\metaengine_output_colchicine_mi.json",
        "sha256": "656812bdd6ab5b35cdd0882a06450d3812477899a0eab29e34a0adbc46dbbd4a",
        "added_at": "2026-02-18T08:36:51.665992+00:00"
      },
      {
        "type": "truthcert",
        "path": "outputs\\run_20260218_083651_00a1b445\\verification\\certificates\\truthcert_run_20260218_083651_c953b3c7.json",
        "sha256": "0ccd8fb821db543a5f1cedf1a7c3ce0e2fd34c6d797d8b6ff108abf7f71fafca",
        "added_at": "2026-02-18T08:36:51.682298+00:00"
      },
      {
        "type": "audit_log",
        "path": "outputs\\run_20260218_083651_00a1b445\\verification\\audit_logs\\audit_run_20260218_083651_c953b3c7.json",
        "sha256": "6b6b62d8158ff1a886268d356648292c3311aae24aaa74f52e93be9f28482865",
        "added_at": "2026-02-18T08:36:51.702003+00:00"
      }
    ]
  }
}