{
  "lec_version": "0.1.0",
  "created_at_utc": "2026-02-18T08:44:33.084064+00:00",
  "updated_at_utc": "2026-02-18T08:44:33.084085+00:00",
  "question": {
    "title": "Meta-analysis for topic: colchicine_mi",
    "pico": {
      "population": "To be specified",
      "intervention": "To be specified",
      "comparator": "To be specified",
      "outcome": "To be specified"
    }
  },
  "evidence_universe": {
    "discovery_artifacts": [
      {
        "path": "outputs\\run_20260218_084432_369956c8\\discovery\\discovery_colchicine_mi_2026-02-18.json",
        "sha256": "42bba0c9830a6a8718dcfe5e63fec3409a526da27e49e84a0653f2345291077c",
        "candidate_count": 5
      }
    ],
    "statistics": {
      "total_candidates": 5,
      "included": 0,
      "flagged": 2,
      "excluded": 3
    }
  },
  "included_studies": {
    "count": 2,
    "study_ids": [
      "NCT:02551094",
      "NCT:03048825"
    ]
  },
  "analysis": {
    "outcome_type": "binary",
    "effect_measure": "HR",
    "model": {
      "type": "random_effects",
      "method": "REML"
    },
    "results": {
      "pooled": {
        "estimate": 0.7215,
        "ci_low": 0.6243,
        "ci_high": 0.8338,
        "se": 0.0738
      },
      "heterogeneity": {
        "i2": 0,
        "tau2": 0,
        "q": 0.5331,
        "df": 1
      }
    },
    "metaengine_contract": {
      "contract_version": "0.1.0",
      "input": {
        "path": "outputs\\run_20260218_084432_369956c8\\metaengine\\metaengine_input_colchicine_mi.json",
        "sha256": "810f322edb565f82e10763fbf0bb73cbc82a495ff12a66b19713a59baba4aa1a"
      },
      "output": {
        "path": "outputs\\run_20260218_084432_369956c8\\metaengine\\metaengine_output_colchicine_mi.json",
        "sha256": "656812bdd6ab5b35cdd0882a06450d3812477899a0eab29e34a0adbc46dbbd4a"
      }
    }
  },
  "verification": {
    "truthcert": {
      "assurance_level": "bronze",
      "decision": "PASS",
      "certificate": {
        "path": "outputs\\run_20260218_084432_369956c8\\verification\\certificates\\truthcert_run_20260218_084432_828f1d48.json",
        "sha256": "5d9c363a587fd5914139167beba58ba25aa10cd0a9c94ffa968203fd5a9c9e39"
      },
      "audit_log": {
        "path": "outputs\\run_20260218_084432_369956c8\\verification\\audit_logs\\audit_run_20260218_084432_828f1d48.json",
        "sha256": "69ef6b6764446a58172ecb54860354032541984a93bcc779ef05713b7549cc5b"
      }
    }
  },
  "reproducibility": {
    "run_id": "run_20260218_084432_da5fdacc",
    "manifest": {
      "path": "outputs\\run_20260218_084432_369956c8\\lec_objects\\manifest_run_20260218_084432_da5fdacc.json",
      "sha256": ""
    },
    "artifacts": [
      {
        "type": "discovery",
        "path": "outputs\\run_20260218_084432_369956c8\\discovery\\discovery_colchicine_mi_2026-02-18.json",
        "sha256": "42bba0c9830a6a8718dcfe5e63fec3409a526da27e49e84a0653f2345291077c",
        "added_at": "2026-02-18T08:44:33.017512+00:00"
      },
      {
        "type": "extraction",
        "path": "data\\sample_extraction.json",
        "sha256": "9c57c4cac7bcbe31c54da6c4969a062477469cc3c542500c890a22ff9dae1ae6",
        "added_at": "2026-02-18T08:44:33.018442+00:00"
      },
      {
        "type": "metaengine_input",
        "path": "outputs\\run_20260218_084432_369956c8\\metaengine\\metaengine_input_colchicine_mi.json",
        "sha256": "810f322edb565f82e10763fbf0bb73cbc82a495ff12a66b19713a59baba4aa1a",
        "added_at": "2026-02-18T08:44:33.019609+00:00"
      },
      {
        "type": "metaengine_output",
        "path": "outputs\\run_20260218_084432_369956c8\\metaengine\\metaengine_output_colchicine_mi.json",
        "sha256": "656812bdd6ab5b35cdd0882a06450d3812477899a0eab29e34a0adbc46dbbd4a",
        "added_at": "2026-02-18T08:44:33.022968+00:00"
      },
      {
        "type": "truthcert",
        "path": "outputs\\run_20260218_084432_369956c8\\verification\\certificates\\truthcert_run_20260218_084432_828f1d48.json",
        "sha256": "5d9c363a587fd5914139167beba58ba25aa10cd0a9c94ffa968203fd5a9c9e39",
        "added_at": "2026-02-18T08:44:33.049567+00:00"
      },
      {
        "type": "audit_log",
        "path": "outputs\\run_20260218_084432_369956c8\\verification\\audit_logs\\audit_run_20260218_084432_828f1d48.json",
        "sha256": "69ef6b6764446a58172ecb54860354032541984a93bcc779ef05713b7549cc5b",
        "added_at": "2026-02-18T08:44:33.080747+00:00"
      }
    ]
  }
}